{"assets":{"body":{"byteCount":404,"height":192,"mediaType":"image/png","path":"assets/body.png","sha256":"259a8fd460ec81bbd33b92e800277f5a227a3278cca833f8b76b1d2979a60e0a","width":128},"brow-left":{"byteCount":91,"height":126,"mediaType":"image/png","path":"assets/brow-left.png","sha256":"0725704c4af8b4af0ff4c99f5e616581c92adf380ca9ad32e1bad0525e2127d3","width":4},"brow-right":{"byteCount":91,"height":126,"mediaType":"image/png","path":"assets/brow-right.png","sha256":"6a07b668123a2681101877c9ce9cd312ec1bc706fa05fad19395a28c3db26f54","width":4},"eye-left":{"byteCount":78,"height":32,"mediaType":"image/png","path":"assets/eye-left.png","sha256":"5acd87fb5af386dcf5f47b1c5cc360d1e6d32335b04e1155fdea4df8ad0f68f8","width":4},"eye-right":{"byteCount":78,"height":32,"mediaType":"image/png","path":"assets/eye-right.png","sha256":"3229a97da75a31653bd8c1cb88509d90c5e46783d3ee47ae1e23301f33a8e35e","width":4},"gaze-left-atlas":{"byteCount":148,"height":44,"mediaType":"image/png","path":"assets/gaze-left-atlas.png","sha256":"f5227a7328fc5433f5baeb51f948eb63b5a568171453f42cf8dddb5b373d282c","width":100},"gaze-right-atlas":{"byteCount":149,"height":44,"mediaType":"image/png","path":"assets/gaze-right-atlas.png","sha256":"a4d526adb73f2369ba80595cea0b6eb05c0115c117cdadcf303896294552cf8a","width":100},"head-mask":{"byteCount":5705,"height":1024,"mediaType":"image/png","path":"assets/head-mask.png","sha256":"e6b7b21576c23b2a07bbff9fef2fc9114b47bf908519f0eaf7e9a52be7603cdc","width":1024},"thumbnail":{"byteCount":158,"height":64,"mediaType":"image/png","path":"assets/thumbnail.png","sha256":"e1416b287d3b4186445ecc656e907765370570bc2d32424ccd93052f96bc714a","width":64},"viseme-E":{"byteCount":5705,"height":1024,"mediaType":"image/png","path":"assets/viseme-E.png","sha256":"7eeca4eb672f1d4ce1930e01035c5ed2e22be9549ec82565a2c745aa429e7837","width":1024},"viseme-FF":{"byteCount":5705,"height":1024,"mediaType":"image/png","path":"assets/viseme-FF.png","sha256":"e81692c50786fdf1b13ae16c31795fed484afe5130c0154545858695744ba3d2","width":1024},"viseme-RR":{"byteCount":5705,"height":1024,"mediaType":"image/png","path":"assets/viseme-RR.png","sha256":"cf66a6a38d389c3fbefc9a68ee7f2f35a0dbc9668a80ab45acebf3cfc0e991c4","width":1024},"viseme-TH":{"byteCount":5705,"height":1024,"mediaType":"image/png","path":"assets/viseme-TH.png","sha256":"a885faa275e06feff6c9947a9ff5e89faced6dce47d4bedd608e5fa8fbb642d1","width":1024},"viseme-aa":{"byteCount":5705,"height":1024,"mediaType":"image/png","path":"assets/viseme-aa.png","sha256":"a6ee86eaa90f9e84cd925b26cd2f3e295ab800ba7441f2f51f8b8f6784c09e84","width":1024},"viseme-ih":{"byteCount":5705,"height":1024,"mediaType":"image/png","path":"assets/viseme-ih.png","sha256":"9c0af199b5a1030f138ac1bb26b09ca22c3b966192dc4bf39303bedc6fe6a9b8","width":1024},"viseme-nn":{"byteCount":5704,"height":1024,"mediaType":"image/png","path":"assets/viseme-nn.png","sha256":"5f4e08a4c94e4e812df176acad4a643737c4fa00dbd2535b402bdb49dfc02da1","width":1024},"viseme-ou":{"byteCount":5705,"height":1024,"mediaType":"image/png","path":"assets/viseme-ou.png","sha256":"8b60a213ed4d82e4738f3db16a168f193a609e2a476208d17af2e51bcba9cac4","width":1024},"viseme-sil":{"byteCount":5705,"height":1024,"mediaType":"image/png","path":"assets/viseme-sil.png","sha256":"655c32ad576de349568fb3bbcbee71f47d8118bb83e02dc781e92e72e14cd381","width":1024}},"displayName":"Motion Guide","format":"openclam-avatar","id":"motion-guide","motions":{"edgeIdle":{"byteCount":1490,"durationMilliseconds":500,"height":96,"mediaType":"video/quicktime","path":"assets/motion-edge-idle.mov","sha256":"6107e669cdf5d576fb6b4982e640dae56dca65019a0d81fac6eeae4c66c94aa2","width":64},"moves":{"byteCount":1378,"durationMilliseconds":500,"height":96,"mediaType":"video/quicktime","path":"assets/motion-moves.mov","sha256":"7cb174150939ee3dc2b901db05e037f7f7e592e7d00a5294d3de8c62284c415d","width":64}},"rig":{"bodySize":{"height":192,"width":128},"faceBoundsInBody":{"height":70,"width":58,"x":35,"y":28},"faceTransform":{"a":0.1,"b":0,"c":0,"d":0.1,"tx":12,"ty":4},"leftBrow":{"box":{"height":3,"width":4,"x":560,"y":450},"columns":14,"rows":3,"storage":"verticalStrip"},"leftEye":{"box":{"height":4,"width":4,"x":560,"y":480},"columns":1,"rows":8,"storage":"verticalStrip"},"leftGaze":{"box":{"height":4,"width":4,"x":560,"y":490},"columns":25,"rows":11,"storage":"gridAtlas"},"rightBrow":{"box":{"height":3,"width":4,"x":456,"y":450},"columns":14,"rows":3,"storage":"verticalStrip"},"rightEye":{"box":{"height":4,"width":4,"x":456,"y":480},"columns":1,"rows":8,"storage":"verticalStrip"},"rightGaze":{"box":{"height":4,"width":4,"x":458,"y":490},"columns":25,"rows":11,"storage":"gridAtlas"}},"variant":"ios-light","version":3}
